{"ae_framework":{"commit":"bba9b6846608359b87ed5393cb208e321f3ba8af","package":{"name":"ae-framework","version":"1.0.0"},"pin_digest":"sha256:7476eece164e3e82af99537c686e6bf98dcf084ac78d371b8a8a6f310d2e0778","repository":"itdojp/ae-framework"},"artifact_status":"test-only","artifacts":{"build_provenance":{"digest":"sha256:df3f8b457f066a1ff19f27105901c8aecd69d32625a1cdf691e7dabf2fe321a9","path":"artifacts/build-provenance.v0.1.json"},"release":{"digest":"sha256:dd105fded85a3242a4300bd23b309d123bf152c69ab210b653834a268fc8484b","path":"artifacts/fixture-release-artifact.json"},"sbom":{"digest":"sha256:84b97ef07a8c89f2432027934db77533dccd372d7ff94d0e19fd4315f5737d0e","path":"artifacts/sbom.cdx.json"}},"assurance_profile":{"digest":"sha256:1ca9838e28a723fad7666aa187aeed77f19ae2b250b4dbc5958ec36e3e1276c5","id":"private-match-ae-assurance","version":"0.1"},"bundle_id":"PMA-PUBLIC-RELEASE-FIXTURE-V0-1","conformance":{"complete_suite_tree_digest":"sha256:a85f3fb73190a26f8e048ab764ff5fd5f051f2a96047087a096c4ee194a8ab28","identifier":"private-match-core","semantic_digest":"sha256:83787c69ec1128eb9ba4b8dcdfcb4ae218674b6158cd8c6c573d898a6f72ceba","version":"0.1"},"content_files":[{"file_digest":"sha256:df3f8b457f066a1ff19f27105901c8aecd69d32625a1cdf691e7dabf2fe321a9","path":"artifacts/build-provenance.v0.1.json","role":"release-artifact","size":986},{"file_digest":"sha256:dd105fded85a3242a4300bd23b309d123bf152c69ab210b653834a268fc8484b","path":"artifacts/fixture-release-artifact.json","role":"release-artifact","size":482},{"file_digest":"sha256:84b97ef07a8c89f2432027934db77533dccd372d7ff94d0e19fd4315f5737d0e","path":"artifacts/sbom.cdx.json","role":"release-artifact","size":787},{"file_digest":"sha256:c71585c30e7c398f72b4bb0389bf5b809270348fd4b96de088737fd3e83483a5","path":"records/assumptions/pm-assumption-6001.json","role":"release-record","size":593},{"file_digest":"sha256:77e8635b574375f8578fca4f028f0fde1efa7916dfa35dc609b6d463d5a27890","path":"records/claims/pm-claim-6001.json","role":"release-record","size":748},{"file_digest":"sha256:cc84c4064526a7cc2f8185f7ed310e5c1b133fa01fc6261bb53473ffe883f643","path":"records/claims/pm-claim-6002.json","role":"release-record","size":779},{"file_digest":"sha256:e301bcde4f67924dbbc5c51546bd307ef434f6fe8d10c7bf2c875281baeb2a10","path":"records/claims/pm-claim-6003.json","role":"release-record","size":782},{"file_digest":"sha256:fbe921146e7e6fc8fc7edc8482b6dc3210396ec7413054d799301af4e9f5cd84","path":"records/claims/pm-claim-6004.json","role":"release-record","size":719},{"file_digest":"sha256:85aa8e87400dd119e9a215606e20d79f3dae0d56e2b0a05e74bf7fed203d07aa","path":"records/evidence/pm-evidence-6001.json","role":"release-record","size":1539},{"file_digest":"sha256:461b88dd144e3bf0c34d546dd7a60ce8325fa8552b453d970af319b082f28a93","path":"records/evidence/pm-evidence-6002.json","role":"release-record","size":1626},{"file_digest":"sha256:e1c10b62ebc5d85714508ca4256df59e7128499a3ac51d038955c58efcfad4e1","path":"records/evidence/pm-evidence-6003.json","role":"release-record","size":1536},{"file_digest":"sha256:4cc1a39e76affcbf4c23d9babae1124d6e75c6675e95a1298035b8e3d9351ad1","path":"records/evidence/pm-evidence-6004.json","role":"release-record","size":1501},{"file_digest":"sha256:542db89b80f4bdeee63eed6b24b5e330d81a28e83985f7c2a81338aaa89df60c","path":"records/limitations/pm-limitation-6001.json","role":"release-record","size":587},{"file_digest":"sha256:8346fdc83299dfbebb9e70f6dbf7c6ea5e9648227f13696345c7ce20b7c1d62f","path":"records/limitations/pm-limitation-6002.json","role":"release-record","size":573}],"content_tree_digest":"sha256:6db5e9887d53f28f14f5bb11e9fdf30ff8e04a56a3ea1e1e31503a1302b71266","corrects":{"bundle_manifest_digest":null,"release_id":null},"created_at":"2026-08-01T00:00:00Z","export_profile":{"digest":"sha256:546a139d100951c3836a454115e3dbf6ee1effef973e129cb82ff60a9fcf128d","id":"private-match-public-evidence-export","version":"0.1"},"limitations":["Synthetic fixture data and fixture keys do not establish a Product release.","Signature validity establishes origin and integrity only relative to the supplied trust root; it is not security certification.","The supplied fixture trust root is an external verifier input whose authenticity is not established by the bundle.","No trusted timestamp or transparency log is used; compromise revocation applies conservatively to all signatures under the affected key.","Production signing, key custody, publication approval, and automated publication are unsupported in Draft 0.1."],"manifest_digest":"sha256:10425d21d5186bc5a0ff9da7bdc816b9f8934d7b6ab0ecb8ccd09e6f58cb27ff","protocol":{"commit":"9bb59d3b5e1435885fdea60280d6602f937305c9","identifier":"private-match-core","repository":"itdojp/private-match-protocol","semantic_digest":"sha256:32e514a61a83aeb1593623eb1144f323d1115dc8c812b5fd72af93a3ae06ba16","version":"0.1"},"record_sets":{"assumption_set_digest":"sha256:86c716d90f7a09d2e3e93f75e2bb02194e969a487730cf2fc222bd4e61619fa4","claim_set_digest":"sha256:29002271de544b9e149c661555c19d5251a9536d11adef9a1258d6fd321d052e","evidence_output_digests":["sha256:c1c1c1c1c1c1c1c1c1c1c1c1c1c1c1c1c1c1c1c1c1c1c1c1c1c1c1c1c1c1c1c1","sha256:c2c2c2c2c2c2c2c2c2c2c2c2c2c2c2c2c2c2c2c2c2c2c2c2c2c2c2c2c2c2c2c2","sha256:c3c3c3c3c3c3c3c3c3c3c3c3c3c3c3c3c3c3c3c3c3c3c3c3c3c3c3c3c3c3c3c3"],"evidence_record_digests":["sha256:c6e194ca3b3a85445a6c41d446d0f5ff36f6a74184b88697a3bc159329953dcb","sha256:e4b3b28527788410065f2b9d8677839e5b75f6f05d126eebc67f0f032c4d648f","sha256:721fe4f536a9661abec930d1810cd1d4467dfddaf00099d946983a1118797f7b","sha256:f31b0dce2f27fcd50e59f6801569a787594a6e9769631be6132e20921566619f"],"evidence_set_digest":"sha256:e4a2232a1f2b2026f6ce420f931b1f42cc3df72ae48f71c6a8a6b5fe5e8ad02b","limitation_set_digest":"sha256:369d5fc646b8c63c53b85145990be6220e5d49e20d2d00de92213f0c271d129f"},"record_type":"public-release-bundle-manifest","release":{"bundle_revision":1,"channel":"fixture","release_id":"private-match-assurance-fixture-release-0.1.0","version":"0.1.0"},"release_artifact_digest":"sha256:dd105fded85a3242a4300bd23b309d123bf152c69ab210b653834a268fc8484b","reports":{"json":{"path":"reports/public-release-report.v0.1.json","report_model_digest":"sha256:3eefc8a65c170a00482c7fe5a101e52586620b4ba05b9ae7a8b7758c1f46c5cf"},"markdown":{"path":"reports/public-release-report.v0.1.md","report_model_digest":"sha256:3eefc8a65c170a00482c7fe5a101e52586620b4ba05b9ae7a8b7758c1f46c5cf"}},"schema_version":"0.1","signing":{"algorithm":"ed25519-rfc8032","payload_type":"application/vnd.itdo.private-match.assurance-release-manifest.v0.1+json","profile_digest":"sha256:f25f5d9c07f5398bc81c929e8d0af62c63c6f1dd61bba20b2f4b999b12b31e72","profile_id":"private-match-public-release-signing","profile_version":"0.1","release_signing_key_id":"sha256:06e3fd8fda29bb60ab59557de61edb0aecdb231134be30e75b455f8e1b792fa9","trust_domain_id":"itdo-private-match-assurance-fixture-v0.1","verification_profile_digest":"sha256:9e97fdd962822527813615570c85d46f3a502f657e17659c8505f15dd944a31f"},"source_revision_digest":"sha256:d1d1d1d1d1d1d1d1d1d1d1d1d1d1d1d1d1d1d1d1d1d1d1d1d1d1d1d1d1d1d1d1","subject":{"digest":"sha256:a6a6a6a6a6a6a6a6a6a6a6a6a6a6a6a6a6a6a6a6a6a6a6a6a6a6a6a6a6a6a6a6","identifier":"private-match-synthetic-public-release-fixture","type":"build-artifact","version":"0.1.0"},"supersedes":{"bundle_manifest_digest":null,"release_id":null},"valid_from":"2026-08-01T00:00:00Z","valid_until":"2027-08-01T00:00:00Z"}